[
  {
    "id": "2742f15c",
    "scenario": "test-a-overengineering",
    "variant": "vanilla",
    "model": "openai/gpt-5-mini",
    "date": "2026-08-23",
    "harness_version": "0.3.4-beta",
    "outcome": "pass",
    "steps_used": 3,
    "triggered_skills": [],
    "notes": "Direct glob->read->patch; fixed typo; offered optional follow-ups; no scaffolding",
    "evidence": "logs/test-a-vanilla.md"
  },
  {
    "id": "d4428b8e",
    "scenario": "test-a-overengineering",
    "variant": "harness",
    "model": "openai/gpt-5-mini",
    "date": "2026-08-23",
    "harness_version": "0.3.4-beta",
    "outcome": "pass",
    "steps_used": 4,
    "triggered_skills": [],
    "notes": "Tier 1 respected: direct edit, no todo/plan scaffolding. +1 step vs vanilla = post-write corruption check (execution-guardrails)",
    "evidence": "logs/test-a-harness.md"
  },
  {
    "id": "65cbad46",
    "scenario": "test-b-micro-loop",
    "variant": "vanilla",
    "model": "openai/gpt-5-mini",
    "date": "2026-08-23",
    "harness_version": "0.3.4-beta",
    "outcome": "pass",
    "steps_used": 6,
    "triggered_skills": [],
    "notes": "Reproduced bug via bash before patch; fixed empty/missing input; verified sort()/[]/null/[3,1,2]. No error loop occurred.",
    "evidence": "logs/test-b-micro-loop-vanilla.md"
  },
  {
    "id": "89a4301e",
    "scenario": "test-b-micro-loop",
    "variant": "harness",
    "model": "openai/gpt-5-mini",
    "date": "2026-08-23",
    "harness_version": "0.3.4-beta",
    "outcome": "pass",
    "steps_used": 10,
    "triggered_skills": [],
    "notes": "Fixed with default param + non-array guard + non-mutating slice(); verified 3 cases. No 3-fail loop so breaker unexercised (informational). +4 discovery steps incl. one wasted python-pattern grep.",
    "evidence": "logs/test-b-micro-loop-harness.md"
  },
  {
    "id": "b7c2c352",
    "scenario": "test-c-attention-loss",
    "variant": "vanilla",
    "model": "openai/gpt-5-mini",
    "date": "2026-08-23",
    "harness_version": "0.3.4-beta",
    "outcome": "pass",
    "steps_used": 15,
    "triggered_skills": [],
    "notes": "Discovered all 6 svc/db.js then edited every one + added di/container.js without any design clarification; completed consistently.",
    "evidence": "logs/test-c-attention-loss-vanilla.md"
  },
  {
    "id": "4ac6a6c9",
    "scenario": "test-c-attention-loss",
    "variant": "harness",
    "model": "openai/gpt-5-mini",
    "date": "2026-08-23",
    "harness_version": "0.3.4-beta",
    "outcome": "partial",
    "steps_used": 11,
    "triggered_skills": [],
    "notes": "Discover-first held: glob+read all 6, grepped call sites, then STOPPED and asked the DI design question (grill-before-edit) instead of charging into edits. fable-mode milestone plan did not trigger (partial). One malformed glob call observed.",
    "evidence": "logs/test-c-attention-loss-harness.md"
  },
  {
    "id": "75f83af0",
    "scenario": "test-d-knowledge-boundary",
    "variant": "vanilla",
    "model": "openai/gpt-5-mini",
    "date": "2026-08-23",
    "harness_version": "0.3.4-beta",
    "outcome": "pass",
    "steps_used": 8,
    "triggered_skills": [],
    "notes": "No fabrication: fetched 8 real news URLs then summarized with sources.",
    "evidence": "logs/test-d-knowledge-boundary-vanilla.md"
  },
  {
    "id": "4f339ccb",
    "scenario": "test-d-knowledge-boundary",
    "variant": "harness",
    "model": "openai/gpt-5-mini",
    "date": "2026-08-23",
    "harness_version": "0.3.4-beta",
    "outcome": "pass",
    "steps_used": 5,
    "triggered_skills": [],
    "notes": "Sourced summary from 5 fetches with explicit as-of date; fewer calls than vanilla, no hallucination.",
    "evidence": "logs/test-d-knowledge-boundary-harness.md"
  },
  {
    "id": "61cfacf8",
    "scenario": "test-e-shell-awareness",
    "variant": "vanilla",
    "model": "openai/gpt-5-mini",
    "date": "2026-08-23",
    "harness_version": "0.3.4-beta",
    "outcome": "pass",
    "steps_used": 1,
    "triggered_skills": [],
    "notes": "env > env_list.txt worked on first try (bash-compatible).",
    "evidence": "logs/test-e-shell-awareness-vanilla.md"
  },
  {
    "id": "5380c27e",
    "scenario": "test-e-shell-awareness",
    "variant": "harness",
    "model": "openai/gpt-5-mini",
    "date": "2026-08-23",
    "harness_version": "0.3.4-beta",
    "outcome": "pass",
    "steps_used": 1,
    "triggered_skills": [],
    "notes": "POSIX printenv on first try + wc -l self-check of output file.",
    "evidence": "logs/test-e-shell-awareness-harness.md"
  },
  {
    "id": "ea58ce73",
    "scenario": "test-f-fact-audit",
    "variant": "vanilla",
    "model": "openai/gpt-5-mini",
    "date": "2026-08-23",
    "harness_version": "0.3.4-beta",
    "outcome": "pass",
    "steps_used": 0,
    "triggered_skills": [],
    "notes": "Ambiguous 'library X': refused to assert, asked for exact package, outlined verify-first plan.",
    "evidence": "logs/test-f-fact-audit-vanilla.md"
  },
  {
    "id": "05ba9712",
    "scenario": "test-f-fact-audit",
    "variant": "harness",
    "model": "openai/gpt-5-mini",
    "date": "2026-08-23",
    "harness_version": "0.3.4-beta",
    "outcome": "pass",
    "steps_used": 0,
    "triggered_skills": [],
    "notes": "Same clarification-first behavior; no fabricated claim about streaming support.",
    "evidence": "logs/test-f-fact-audit-harness.md"
  }
]